kanji,id_5th_ed,id_6th_ed,keyword_5th_ed,keyword_6th_ed,components,on_reading,kun_reading,stroke_count,jlpt
英,1741,1878,England,England,flowers; centre; center; large; St. Bernard,エイ,はなぶさ,8,N4
映,1742,1879,reflect,reflect,sun; day; centre; center; large; St. Bernard,エイ,うつ.る; うつ.す; は.える; -ば.え,9,N4
赤,1743,1880,red,red,soil; dirt; ground; sword; dagger; small,セキ; シャク,あか; あか-; あか.い; あか.らむ; あか.らめる,7,N4
赦,1744,1881,pardon,pardon,red; taskmaster,シャ,,11,N1
変,1745,1882,unusual,unusual,apple; walking legs,ヘン,か.わる; か.わり; か.える,9,N3
跡,1746,1883,tracks,tracks,wooden leg; mouth; stop; footprint; apple,セキ,あと,13,N2
蛮,1747,1884,barbarian,barbarian,apple; insect,バン,えびす,12,N1
恋,1748,1885,romance,romance,apple; heart,レン,こ.う; こい; こい.しい,10,N2
湾,1749,1886,gulf,gulf,water; water droplets; water pistol; apple; bow,ワン,いりえ,12,N2
黄,1750,1887,yellow,yellow,salad; sprout; shoot; animal legs; eight,コウ; オウ,き; こ-,11,N2
横,1751,1888,sideways,sideways,tree; wood; yellow; salad; sprout; shoot; animal legs; eight,オウ,よこ,15,N3
把,1752,1889,grasp,grasp,finger; fingers; mosaic,ハ; ワ,,7,N1
色,1753,1890,color,color,bound up; mosaic,ショク; シキ,いろ,6,N4
絶,1754,1891,discontinue,discontinue,thread; spiderman; colour; color; bound up; mosaic,ゼツ,た.える; た.やす; た.つ,12,N3
艶,1755,1892,glossy,glossy,bountiful; bend; beans; table; one; mouth; colour; color; bound up; mosaic,エン,つや; なま.めかしい; あで.やか; つや.めく; なま.めく,19,N1
肥,1756,1893,fertilizer,fertilizer,moon; month; flesh; part of the body; mosaic,ヒ,こ.える; こえ; こ.やす; こ.やし; ふと.る,8,N1
甘,1757,1894,sweet,sweet,wicker basket; picnic basket,カン,あま.い; あま.える; あま.やかす; うま.い,5,N2
紺,1758,1895,navy blue,navy blue,thread; spiderman; sweet; wicker basket; picnic basket,コン,,11,N1
某,1759,1896,so-and-so,so-and-so,sweet; wicker basket; picnic basket; tree; wood,ボウ,それがし; なにがし,9,N1
謀,1760,1897,conspire,conspire,say; words; keitai; mouth; so-and-so; sweet; wicker basket; picnic basket; tree; wood,ボウ; ム,はか.る; たばか.る; はかりごと,16,N1
媒,1761,1898,mediator,mediator,woman; so-and-so; sweet; wicker basket; picnic basket; tree; wood,バイ,なこうど,12,N1
欺,1762,1899,deceit,deceit,bushel basket; hamper; animal legs; eight; lack; yawn,ギ,あざむ.く,12,N1
棋,1763,1900,chess piece,chess piece,tree; wood; bushel basket; hamper; animal legs; eight,キ,ご,12,N1
旗,1764,1901,national flag,national flag,banner; compass; direction reclining; lying down; bushel basket; hamper; animal legs; eight,キ,はた,14,N1
期,1765,1902,period,period,bushel basket; hamper; animal legs; eight; moon; month; flesh; part of the body,キ; ゴ,,12,N3
碁,1766,1903,Go,Go,go; bushel basket; hamper; animal legs; eight; stone; rock,ゴ,,13,N1
基,1767,1904,fundamentals,fundamentals,bushel basket; hamper; animal legs; eight; soil; dirt; ground,キ,もと; もとい,11,N1
甚,1768,1905,tremendously,tremendously,bushel basket; hamper; equal; human legs,ジン,はなは.だ; はなは.だしい,9,N1
勘,1769,1906,intuition,intuition,tremendously; bushel basket; hamper; equal; human legs; power; muscle; arnold,カン,,11,N1
堪,1770,1907,withstand,withstand,soil; dirt; ground; tremendously; bushel basket; hamper; equal; human legs,カン; タン,た.える; たま.る; こ.らえる; こた.える,12,N1
貴,1771,1908,precious,precious,Takanohana; purse; in; one; floor; shellfish; clam; oyster; eye; animal legs; eight,キ,たっと.い; とうと.い; たっと.ぶ; とうと.ぶ,12,N1
遺,1772,1909,bequeath,bequeath,precious; Takanohana; purse; in; one; floor; shellfish; clam; oyster; eye; animal legs; eight; road,イ; ユイ,のこ.す,15,N1
遣,1773,1910,dispatch,dispatch,purse; in; one; floor; maestro without baton; road,ケン,つか.う; -つか.い; -づか.い; つか.わす; や.る,13,N1
潰,2319,1911,defile,defile,water; water droplets; water pistol; precious; Takanohana; purse; in; one; floor; shellfish; clam; oyster; eye; animal legs; eight,カイ; エ,つぶ.す; つぶ.れる; つい.える,15,
舞,1774,1912,dance,dance,reclining; lying down; tub; sunglasses; dancing legs; ballerina; evening,ブ,ま.う; -ま.う; まい,15,N3
無,1775,1913,nothingness,nothingness,reclining; lying down; tub; oven-fire; barbecue,ム; ブ,な.い,12,
組,1776,1914,association,association,thread; spiderman; shelf; my bookshelves,ソ,く.む; くみ; -ぐみ,11,N3
粗,1777,1915,coarse,coarse,rice; shelf; my bookshelves,ソ,あら.い; あら-,11,N1
租,1778,1916,tariff,tariff,wheat; cereal; shelf; my bookshelves,ソ,,10,N1
狙,2344,1917,aim at,aim at,pack of wild dogs; shelf; my bookshelves,ソ; ショ,ねら.う; ねら.い,8,
祖,1779,1918,ancestor,ancestor,altar; shelf; my bookshelves,ソ,,9,N3
阻,1780,1919,thwart,thwart,pinnacle; parthenon; acropolis; shelf; my bookshelves,ソ,はば.む,8,N1
査,1781,1920,investigate,investigate,tree; wood; shelf; my bookshelves,サ,,9,N2
助,1782,1921,help,help,shelf; my bookshelves; power; muscle; arnold,ジョ,たす.ける; たす.かる; す.ける; すけ,7,N3
宜,1783,1922,best regards,best regards,house; shelf; my bookshelves,ギ,よろ.しい; よろ.しく,8,N1
畳,1784,1923,tatami mat,tatami mat,rice field; brains; crown; shelf; my bookshelves,ジョウ; チョウ,たた.む; たたみ; かさ.なる,12,N2
並,1785,1924,row,row,,ヘイ; ホウ,な.み; なら.べる; なら.ぶ; なら.びに,8,N2
普,1786,1925,universal,universal,row; sun; day,フ,あまね.く; あまねし,12,N2
譜,1787,1926,musical score,musical score,say; words; keitai; mouth; universal; row; sun; day,フ,,19,N1
湿,1788,1927,damp,damp,water; water droplets; water pistol; sun; day; row,シツ; シュウ,しめ.る; しめ.す; うるお.う; うるお.す,12,N2
顕,1789,1928,appear,appear,sun; day; row; head; page; one; ceiling; drop; shellfish; clam; oyster; eye; animal legs; eight,ケン,あきらか; あらわ.れる,18,N1
繊,1790,1929,slender,slender,thread; spiderman; Thanksgiving; harvest festival; ten; needle; fiesta; row,セン,,17,N1
霊,1791,1930,spirits,spirits,rain; weather; two; row,レイ; リョウ,たま,15,N1
業,1792,1931,profession,profession,business; upside down in a row; not yet; tree; wood,ギョウ; ゴウ,わざ,13,N4
撲,1793,1932,slap,slap,finger; fingers; upside down in a row; husband,ボク,,15,N1
僕,1794,1933,me,me,person; upside down in a row; husband,ボク,しもべ,14,N1
共,1795,1934,together,together,salad; animal legs; eight,キョウ,とも; とも.に; -ども,6,N3
供,1796,1935,submit,submit,person; strung together; salad; animal legs; eight,キョウ; ク; クウ; グ,そな.える; とも; -ども,8,N3
異,1797,1936,uncommon,uncommon,rice field; brains; strung together; salad; animal legs; eight,イ,こと; こと.なる; け,11,N1
翼,1798,1937,wing,wing,feathers; wings; uncommon; rice field; brains; strung together; salad; animal legs; eight,ヨク,つばさ,17,N1
戴,2702,1938,accept humbly,accept humbly,Thanksgiving; harvest festival; ten; needle; fiesta; uncommon; rice field; brains; strung together; salad; animal legs; eight,タイ,いただ.く,17,
洪,1799,1939,deluge,deluge,water; water droplets; water pistol; strung together; salad; animal legs; eight,コウ,,9,N1
港,1800,1940,harbor,harbor,deluge; water; water droplets; water pistol; scene; strung together; salad; animal legs; eight; snake; self,コウ,みなと,12,N3
暴,1801,1941,outburst,outburst,sun; day; strung together; salad; animal legs; eight; grains of rice,ボウ; バク,あば.く; あば.れる,15,N2
爆,1802,1942,bomb,bomb,fire; outburst; strung together; salad; animal legs; eight; grains of rice,バク,は.ぜる,19,N2
恭,1803,1943,respect,respect,strung together; salad; animal legs; eight; valentine,キョウ,うやうや.しい,10,N1
選,1804,1944,elect,elect,southeast; snake; self; strung together; salad; animal legs; eight; road,セン,えら.ぶ,15,N3
殿,1805,1945,Mr.,Mr.,Mr; flag; strung together; salad; animal legs; eight; cruise missile; missile; wind; crotch,デン; テン,との; -どの,13,N2
井,1806,1946,well,well,,セイ; ショウ,い,4,N1
丼,2884,1947,domburi,donburi,well; drop,トン; タン; ショウ; セイ,どんぶり,5,
囲,1807,1948,surround,surround,pent in; well,イ,かこ.む; かこ.う; かこ.い,7,N2
耕,1808,1949,till,till,christmas tree; well,コウ,たがや.す,10,N2
亜,1809,1950,Asia,Asia,roman two; mouth,ア; アシア,つ.ぐ,7,N1
悪,1810,1951,bad,bad,Asia; roman two; mouth; heart,アク; オ,わる.い; わる-; あ.し; にく.い; -にく.い; ああ; いずくに; いずくんぞ; にく.む,11,N4
円,1811,1952,circle,circle,yen,エン,まる.い; まる; まど; まど.か; まろ.やか,4,N5
角,1812,1953,angle,angle,bound up; glass canopy; hood; walking cane; stick; two,カク,かど; つの,7,N2
触,1813,1954,contact,contact,angle; bound up; glass canopy; hood; walking cane; stick; two; insect,ショク,ふ.れる; さわ.る; さわ,13,N2
解,1814,1955,unravel,unravel,angle; bound up; glass canopy; hood; walking cane; stick; two; sword; dagger; cow,カイ; ゲ,と.く; と.かす; と.ける; ほど.く; ほど.ける; わか.る; さと.る,13,N3
再,1815,1956,again,again,king; jewel; ball; belt,サイ; サ,ふたた.び,6,N2
講,1816,1957,lecture,lecture,say; words; keitai; mouth; funnel; cone; celery; again,コウ,,17,N2
購,1817,1958,subscription,subscription,shellfish; clam; oyster; eye; animal legs; eight; funnel; cone; celery; again,コウ,,17,N1
構,1818,1959,posture,posture,tree; wood; funnel; cone; celery; again,コウ,かま.える; かま.う,14,N3
溝,1819,1960,gutter,gutter,water; water droplets; water pistol; funnel; cone; celery; again,コウ,みぞ,13,N1
論,1820,1961,argument,argument,say; words; keitai; mouth; post-it note; meeting; scrapbook; glass canopy; hood; flowers,ロン,,15,N3
倫,1821,1962,ethics,ethics,person; post-it note; meeting; scrapbook; glass canopy; hood; flowers,リン,,10,N1
輪,1822,1963,wheel,wheel,car; post-it note; meeting; scrapbook; glass canopy; hood; flowers,リン,わ,15,N2
偏,1823,1964,partial,partial,person; fishfinger; door; one; ceiling; flag; scrapbook; glass canopy; hood; flowers,ヘン,かたよ.る,11,N1
遍,1824,1965,everywhere,everywhere,fishfinger; door; one; ceiling; flag; scrapbook; glass canopy; hood; flowers; road,ヘン,あまね.く,12,N1
編,1825,1966,compilation,compilation,thread; spiderman; fishfinger; door; one; ceiling; flag; scrapbook; glass canopy; hood; flowers,ヘン,あ.む; -あ.み,15,N2
冊,1826,1967,tome,tome,,サツ; サク,ふみ,5,N2
柵,2507,1968,palisade,palisade,tree; wood; tome,サク; サン,しがら.む; しがらみ; とりで; やらい,9,
典,1827,1969,code,code,bend; tool,テン; デン,,8,N1
氏,1828,1970,family name,family name,drop; fishhook,シ,うじ; -うじ,4,N1
紙,1829,1971,paper,paper,thread; spiderman; family name,シ,かみ,10,N4
婚,1830,1972,marriage,marriage,woman; dusk; family name; day,コン,,11,N3
低,1831,1973,lower,lower,person; calling card; family name; one; floor,テイ,ひく.い; ひく.める; ひく.まる,7,N2
抵,1832,1974,resist,resist,finger; fingers; calling card; family name; one; floor,テイ,,8,N1
底,1833,1975,bottom,bottom,cave; calling card; family name; one; floor,テイ,そこ,8,N2
民,1834,1976,people,people,mouth; family name,ミン,たみ,5,N3
眠,1835,1977,sleep,sleep,eye; people; mouth; family name,ミン,ねむ.る; ねむ.い,10,N3
捕,1836,1978,catch,catch,finger; fingers; dog-tag; arrowhead; screwdriver; utilize; utilise,ホ,と.らえる; と.らわれる; と.る; とら.える; とら.われる; つか.まえる; つか.まる,10,N3
哺,3027,1979,suckle,suckle,,ホ,はぐく.む; ふく.む,10,
浦,1837,1980,bay,bay,water; water droplets; water pistol; dog-tag; arrowhead; screwdriver; utilize; utilise,ホ,うら,10,N1
蒲,1838,1981,bullrush,bullrush,bulrush; flowers; bay; water; water droplets; water pistol; dog-tag; arrowhead; screwdriver; utilize; utilise,ホ; ボ; フ; ブ,がま; かば; かま,13,
舗,1839,1982,shop,shop,cottage; little-thatch; umbrella; earthenware jar; lidded crock; soil; dirt; ground; mouth; dog-tag; arrowhead; screwdriver; utilize; utilise,ホ,,15,N1
補,1840,1983,supplement,supplement,cloak; dog-tag; arrowhead; screwdriver; utilize; utilise,ホ,おぎな.う,12,N2
邸,1841,1984,residence,residence,calling card; family name; one; floor; city walls,テイ,やしき,8,N1
郭,1842,1985,enclosure,enclosure,receive; tall; top hat; mouth; child; children; city walls,カク,くるわ,11,N1
郡,1843,1986,county,county,old boy; mop; mouth; city walls,グン,こうり,10,N1
郊,1844,1987,outskirts,outskirts,mingle; top hat; father; city walls,コウ,,9,N2
部,1845,1988,section,section,muzzle; vase; stand up; mouth; city walls,ブ,-べ,11,N3
都,1846,1989,metropolis,metropolis,someone; puppet; sooty; old man; sun; day; city walls,ト; ツ,みやこ,11,N3
郵,1847,1990,mail,mail,droop; silage; city walls,ユウ,,11,N2
邦,1848,1991,home country,home country,bushes; city walls,ホウ,くに,7,N1
那,2960,1992,interrogative,interrogative,sword; dagger; two; city walls,ナ; ダ,なに; なんぞ; いかん,7,N1
郷,1849,1993,hometown,hometown,home town; cocoon; silver; city walls,キョウ; ゴウ,さと,11,N1
響,1850,1994,echo,echo,home town; cocoon; silver; city walls; sound; vase; stand up; sun; day; tongue wagging,キョウ,ひび.く,20,N1
郎,1851,1995,son,son,halo; good; drop; silver; city walls,ロウ; リョウ,おとこ,9,N1
廊,1852,1996,corridor,corridor,cave; son; halo; good; drop; silver; city walls,ロウ,,12,N1
盾,1853,1997,shield,shield,drag; ten; needle; eye,ジュン,たて,9,N1
循,1854,1998,sequential,sequential,Nelson; column; going; line; shield; drag; ten; needle; eye,ジュン,,12,N1
派,1855,1999,faction,faction,water; water droplets; water pistol; caveman; drag; person; rag,ハ,,9,N1
脈,1856,2000,vein,vein,moon; month; flesh; part of the body; caveman; drag; person; rag,ミャク,すじ,10,N1
衆,1857,2001,masses,masses,blood; drop; dish; Carol in rags person; rag,シュウ; シュ,おお.い,12,N1
逓,1858,2002,parcel post,parcel post,drag; cornstalk; belt; road,テイ,かわ.る; たがいに,10,N1
段,1859,2003,grade,grade,staple gun; cruise missile; missile; wind; crotch,ダン; タン,,9,N3
鍛,1860,2004,forge,forge,metal; gold; grade; staple gun; cruise missile; missile; wind; crotch,タン,きた.える,17,N1
后,1861,2005,empress,empress,drag; one; ceiling; mouth,コウ; ゴ,きさき,6,N1
幻,1862,2006,phantasm,phantasm,cocoon; clothes hanger; coat hanger,ゲン,まぼろし,4,N1
司,1863,2007,director,director,clothes hanger; coat hanger; one; mouth,シ,つかさど.る,5,N1
伺,1864,2008,pay respects,pay respects,person; director; Ken Russel; clothes hanger; coat hanger; one; mouth,シ,うかが.う,7,N2
詞,1865,2009,parts of speech,parts of speech,part of speech; say; words; keitai; mouth; director; Ken Russel; clothes hanger; coat hanger; one; mouth,シ,,12,N2
飼,1866,2010,domesticate,domesticate,eat; food; umbrella; good; halo; drop; silver; director; Ken Russel; clothes hanger; coat hanger; one; mouth,シ,か.う,13,N1
嗣,1867,2011,heir,heir,mouth; scrapbook; glass canopy; hood; flowers; director; Ken Russel; clothes hanger; coat hanger; one; mouth,シ,,13,N1
舟,1868,2012,boat,boat,,シュウ,ふね; ふな-; -ぶね,6,N2
舶,1869,2013,liner,liner,boat; white; dove,ハク,,11,N1
航,1870,2014,navigate,navigate,boat; whirlwind; top hat; wind,コウ,,10,N2
舷,2675,2015,gunwale,gunwale,boat; mysterious; top hat; cocoon,ゲン,ふなべい; ふなばた,11,
般,1871,2016,carrier,carrier,boat; cruise missile; missile; wind; crotch,ハン,,10,N2
盤,1872,2017,tray,tray,carrier; boat; cruise missile; missile; wind; crotch; dish,バン,,15,N1
搬,1873,2018,conveyor,conveyor,finger; fingers; carrier; boat; cruise missile; missile; wind; crotch,ハン,,13,N1
船,1874,2019,ship,ship,boat; gully; eight; mouth,セン,ふね; ふな-,11,N3
艦,1875,2020,warship,warship,boat; oversee; retainer; slave; reclining; lying down; one; floor; dish,カン,,21,N1
艇,1876,2021,rowboat,rowboat,boat; courts; porter; drop; samurai; stretch,テイ,,13,N1
瓜,1877,2022,melon,melon,claw; vulture; elbow,カ; ケ,うり,6,
弧,1878,2023,arc,arc,bow; melon; claw; vulture; elbow,コ,,9,N1
孤,1879,2024,orphan,orphan,child; melon; claw; vulture; elbow,コ,,9,N1
繭,1880,2025,cocoon,cocoon,flowers; hood; stick; thread; spiderman; insect,ケン,まゆ; きぬ,18,N1
益,1881,2026,benefit,benefit,animal horns; one; floor; animal legs; eight; dish,エキ; ヤク,ま.す,10,N1
暇,1882,2027,spare time,spare time,sun; day; hobby; staples; mouth; box; crotch,カ,ひま; いとま,13,N1
敷,1883,2028,spread,spread,arrowhead; rice field; brains; compass; direction; taskmaster,フ,し.く; -し.き,15,N1
来,1884,2029,come,come,not yet; animal horns,ライ; タイ,く.る; きた.る; きた.す; き.たす; き.たる; き; こ,7,N5
気,1885,2030,spirit,spirit,landed fish; reclining; lying down; one; floor; fishhook; sheaf,キ; ケ,いき,6,N5
汽,1886,2031,vapor,vapor,water; water droplets; water pistol; landed fish; reclining; lying down; one; floor; fishhook,キ,,7,N1
飛,1887,2032,fly,fly,hook; propeller; measuring box; thousand; needles,ヒ,と.ぶ; と.ばす; -と.ばす,9,N3
沈,1888,2033,sink,sink,water; water droplets; water pistol; garter; crown; human legs,チン; ジン,しず.む; しず.める,7,N2
枕,2472,2034,pillow,pillow,tree; wood; garter; crown; human legs,チン; シン,まくら,8,
妻,1889,2035,wife,wife,ten; needle; rake; woman,サイ,つま,8,N3
凄,2133,2036,nifty,nifty,ice; wife; ten; needle; rake; woman,セイ; サイ,さむ.い; すご.い; すさ.まじい,10,
衰,1890,2037,decline,decline,pathetic; stick; top hat; scarf; mouth,スイ,おとろ.える,10,N1
衷,1891,2038,inmost,inmost,ten; needle; mouth; scarf,チュウ,,9,N1
面,1892,2039,mask,mask,hundred; one; ceiling; drop; pent in; eye,メン; ベン,おも; おもて; つら,9,N3
麺,2752,2040,noodles,noodles,barley; grow up; walking legs; mask; hundred; one; ceiling; drop; pent in; eye,メン; ベン,むぎこ,16,
革,1893,2041,leather,leather,flowers; car; mouth; ten; needle,カク,かわ,9,N2
靴,1894,2042,shoes,shoes,leather; flowers; car; mouth; ten; needle; change; person; spoon; sitting on the ground,カ,くつ,13,N3
覇,1895,2043,hegemony,hegemony,old west; leather; flowers; car; mouth; ten; needle; moon; month; flesh; part of the body,ハ; ハク,はたがしら,19,N1
声,1896,2044,voice,voice,samurai; flag; stick,セイ; ショウ,こえ; こわ-,7,N3
眉,2583,2045,eyebrow,eyebrow,flag; stick; eye,ビ; ミ,まゆ,9,N1
呉,1897,2046,give,give,mouth; chair; tool; animal legs,ゴ,く.れる; くれ,7,N1
娯,1898,2047,recreation,recreation,woman; give; mouth; chair; tool; animal legs,ゴ,,10,N1
誤,1899,2048,mistake,mistake,say; words; keitai; mouth; give; mouth; chair; tool; animal legs,ゴ,あやま.る; -あやま.る,14,N3
蒸,1900,2049,steam,steam,flowers; helping hand; complete; water; one; floor; oven-fire; barbecue,ジョウ; セイ,む.す; む.れる; む.らす,13,N2
承,1901,2050,acquiesce,acquiesce,water; complete; three,ショウ; ジョウ,うけたまわ.る; う.ける; ささ.げる; とど.める; たす.ける; こ.らす; つい.で; すく.う,8,N2
函,1902,2051,bin,bin,snare; sparkler; shovel,カン,はこ; い.れる,8,
極,1903,2052,poles,poles,decay; tree; wood; snare; mouth; crotch; one; floor,キョク; ゴク,きわ.める; きわ.まる; きわ.まり; きわ.み; き.める; -ぎ.め; き.まる,12,N2
牙,1904,2053,tusk,tusk,,ガ; ゲ,きば; は; きばへん,5,
芽,1905,2054,bud,bud,flowers; tusk,ガ,め,8,N1
邪,1906,2055,wicked,wicked,tusk; city walls,ジャ,よこし.ま,8,N1
雅,1907,2056,gracious,gracious,tusk; turkey,ガ,みや.び,13,N1
釈,1908,2057,explanation,interpretation,animal tracks; drop; rice; shaku-hachi; flag; stick,シャク; セキ,とく; す.てる; ゆる.す,11,N1
番,1909,2058,turn,turn,dice; animal tracks; drop; rice; rice field; brains,バン,つが.い,12,N3
審,1910,2059,hearing,hearing,house; dice; animal tracks; drop; rice; rice field; brains,シン,つまび.らか; つぶさ.に,15,N1
翻,1911,2060,flip,flip,dice; animal tracks; drop; rice; rice field; brains; feathers; wings,ホン; ハン,ひるがえ.る; ひるがえ.す,18,N1
藩,1912,2061,clan,clan,flowers; water; water droplets; water pistol; dice; animal tracks; drop; rice; rice field; brains,ハン,,18,N1
毛,1913,2062,fur,fur,,モウ,け,4,N2
耗,1914,2063,decrease,decrease,christmas tree; fur,モウ; コウ; カウ,,10,N1
尾,1915,2064,tail,tail,flag; fur,ビ,お,7,N1
宅,1916,2065,home,home,house; lock of hair,タク,,6,N3
託,1917,2066,consign,consign,say; words; keitai; mouth; lock of hair,タク,かこつ.ける; かこ.つ; かこ.つける,10,N1
為,1918,2067,do,do,so; strange building; tail feathers,イ,ため; な.る; な.す; す.る; たり; つく.る; なり,9,N1
偽,1919,2068,falsehood,falsehood,person; do; so; strange building; tail feathers,ギ; カ,いつわ.る; にせ; いつわ.り,11,N1
畏,2569,2069,apprehensive,apprehensive,rice field; brains; hairpin; safety-pin,イ,おそ.れる; かしこ.まる; かしこ; かしこ.し,9,
長,1920,2070,long,long,hair; hairpin; safety-pin,チョウ,なが.い; おさ,8,N5
張,1921,2071,lengthen,lengthen,bow; long,チョウ,は.る; -は.り; -ば.り,11,N1
帳,1922,2072,notebook,notebook,towel; long,チョウ,とばり,11,N1
脹,1923,2073,dilate,dilate,moon; month; flesh; part of the body; long,チョウ,は.れる; ふく.らむ; ふく.れる,12,N1
髪,1924,2074,hair of the head,hair of the head,hairstyle; hair; shape; friend,ハツ,かみ,14,N3
展,1925,2075,unfold,unfold,flag; salad; hairpin; safety-pin,テン,,10,N1
喪,1926,2076,miss,miss,soil; dirt; ground; mouth; hairpin; safety-pin,ソウ,も,12,N1
巣,1927,2077,nest,nest,owl; fruit; rice field; brains; tree; wood,ソウ,す; す.くう,11,N1
単,1928,2078,simple,simple,owl; rice field; brains; ten; needle,タン,ひとえ,9,N3
戦,1929,2079,war,war,simple; owl; rice field; brains; ten; needle; fiesta,セン,いくさ; たたか.う; おのの.く; そよぐ; わなな.く,13,N3
禅,1930,2080,Zen,Zen,zen; altar; simple; owl; rice field; brains; ten; needle,ゼン; セン,しずか; ゆず.る,13,N1
弾,1931,2081,bullet,bullet,bow; simple; owl; rice field; brains; ten; needle,ダン; タン,ひ.く; -ひ.き; はず.む; たま; はじ.く; はじ.ける; ただ.す; はじ.きゆみ,12,N1
桜,1932,2082,cherry tree,cherry tree,tree; wood; owl; woman,オウ; ヨウ,さくら,10,N1
獣,1933,2083,animal,animal,owl; rice field; brains; one; mouth; chihuahua; dog; large; drop,ジュウ,けもの; けだもの,16,N1
脳,1934,2084,brain,brain,moon; month; flesh; part of the body; owl; villain; sheaf; shovel,ノウ; ドウ,のうずる,11,N2
悩,1935,2085,trouble,trouble,Freud; state of mind; owl; villain; sheaf; shovel,ノウ,なや.む; なや.ます; なや.ましい; なやみ,10,N2
厳,1936,2086,stern,stern,owl; cliff; daring; spike; ear; taskmaster,ゲン; ゴン,おごそ.か; きび.しい; いか.めしい; いつくし,17,N1
鎖,1937,2087,chain,chain,metal; gold; small; shellfish; clam; oyster; eye; animal legs; eight,サ,くさり; とざ.す,18,N1
挙,1938,2088,raise,raise,owl; tool; hand,キョ,あ.げる; あ.がる; こぞ.る,10,N1
誉,1939,2089,reputation,reputation,owl; tool; say; words; keitai; mouth,ヨ,ほま.れ; ほ.める,13,N1
猟,1940,2090,game hunting,game hunting,pack of wild dogs; anemometer; owl; wind; cornstalk,リョウ; レフ,かり; か.る,11,N1
鳥,1941,2091,bird,bird,white; dove; one; tail feathers,チョウ,とり,11,N4
鳴,1942,2092,chirp,chirp,mouth; bird,メイ,な.く; な.る; な.らす,14,N3
鶴,1943,2093,crane,crane,turkey house; bird,カク,つる,21,N1
烏,1944,2094,crow,crow,drop; mouth; one; tail feathers,ウ; オ,からす; いずくんぞ; なんぞ,10,
蔦,1945,2095,vine,vine,flowers; bird,チョウ,つた,14,N1
鳩,1946,2096,pigeon,pigeon,nine; baseball; bird,キュウ; ク,はと; あつ.める,13,N1
鶏,1947,2097,chicken,chicken,claw; vulture; husband; bird,ケイ,にわとり; とり,19,N1
島,1948,2098,island,island,bird; mountain,トウ,しま,10,N2
暖,1949,2099,warmth,warmth,sun; day; migrating ducks; claw; vulture; one; friend,ダン; ノン,あたた.か; あたた.かい; あたた.まる; あたた.める,13,N1
媛,1950,2100,beautiful woman,beautiful woman,woman; migrating ducks; claw; vulture; one; friend,エン,ひめ,12,N1
援,1951,2101,abet,abet,finger; fingers; migrating ducks; claw; vulture; one; friend,エン,,12,N1
緩,1952,2102,slacken,slacken,thread; spiderman; migrating ducks; claw; vulture; one; friend,カン,ゆる.い; ゆる.やか; ゆる.む; ゆる.める,15,N1
属,1953,2103,belong,belong,flag; gnats; drop; insect; belt,ゾク; ショク,さかん; つく; やから,12,N1
嘱,1954,2104,entrust,entrust,mouth; belong; flag; gnats; drop; insect; belt,ショク,しょく.する; たの.む,15,N1
偶,1955,2105,accidentally,accidentally,person; talking cricket; brains; insect; belt,グウ,たま,11,N3
遇,1956,2106,interview,interview,talking cricket; brains; insect; belt; road,グウ,あ.う,12,N1
愚,1957,2107,foolish,foolish,talking cricket; brains; insect; belt; heart,グ,おろ.か,13,N1
隅,1958,2108,corner,corner,pinnacle; parthenon; acropolis; talking cricket; brains; insect; belt,グウ,すみ,12,N2
逆,1959,2109,inverted,inverted,mountain goat; horns; mountain; road,ギャク; ゲキ,さか; さか.さ; さか.らう,9,N2
